{
  "schema_version": "1.0",
  "name": "godot-project-doctor",
  "entrypoint": "godot-project-doctor",
  "module": "python -m godot_project_doctor",
  "interfaces": {
    "cli": true,
    "machine_output": ["json"],
    "human_output": ["text", "markdown", "html"],
    "visual_interface": "static html report"
  },
  "run_behavior": {
    "noninteractive": true,
    "safe_on_private_projects": true,
    "network_required": false,
    "writes_only_when_requested": true,
    "exit_codes": {
      "0": "plan/dry-run succeeded or no findings at selected fail threshold",
      "1": "findings met selected fail threshold",
      "2": "CLI or argument error"
    }
  },
  "recommended_commands": [
    {
      "purpose": "Inspect a project and recommend checks",
      "command": "godot-project-doctor inspect <project> --format json"
    },
    {
      "purpose": "Show prioritized check recommendations",
      "command": "godot-project-doctor recommend <project>"
    },
    {
      "purpose": "Show a first-run profile checklist",
      "command": "godot-project-doctor doctor <project> --profile release"
    },
    {
      "purpose": "Preview starter config and workflow",
      "command": "godot-project-doctor init <project> --dry-run --include-workflow"
    },
    {
      "purpose": "Script-friendly dry run",
      "command": "godot-project-doctor run --project <project> --checks assets,export,mobile_perf --dry-run --format json"
    },
    {
      "purpose": "Static HTML report from existing JSON reports",
      "command": "godot-project-doctor summarize reports/godot-project-doctor --format html --output reports/index.html"
    },
    {
      "purpose": "Compare two report folders",
      "command": "godot-project-doctor compare reports/baseline reports/current --format markdown --fail-on warning"
    },
    {
      "purpose": "Collect reports into one evidence folder",
      "command": "godot-project-doctor collect godot-project-doctor.toml --evidence-dir reports/godot-project-doctor/evidence"
    }
  ]
}
