{
  "schema_version": "1.0",
  "name": "godot-scene-signal-auditor",
  "entrypoint": "godot-signal-audit",
  "module": "python -m godot_signal_auditor",
  "interfaces": {
    "cli": true,
    "machine_output": ["json"],
    "human_output": ["text", "mermaid graph"],
    "report_metadata": true,
    "plain_language_rule_help": true,
    "scene_contracts": true,
    "contract_diff": true,
    "node_group_contracts": true,
    "exported_property_contracts": true,
    "visual_interface": "Mermaid graph output"
  },
  "run_behavior": {
    "noninteractive": true,
    "safe_on_private_projects": true,
    "network_required": false,
    "writes_only_when_requested": true,
    "exit_codes": {
      "0": "no findings at selected fail threshold, or --fail-on none",
      "1": "findings met selected fail threshold",
      "2": "CLI or argument error"
    }
  },
  "recommended_commands": [
    {
      "purpose": "Script-friendly signal report",
      "command": "godot-signal-audit <project> --autoload EventBus,SignalBus --format json --output signal-report.json --fail-on none"
    },
    {
      "purpose": "Architecture graph",
      "command": "godot-signal-audit <project> --format mermaid --output docs/SIGNAL_GRAPH.md --fail-on none"
    },
    {
      "purpose": "Scene contract check before refactoring",
      "command": "godot-signal-audit <project> --contract scene-contract.json --format json --output reports/scene-contract.json"
    },
    {
      "purpose": "Scene contract diff after refactoring",
      "command": "godot-signal-audit <project> --contract scene-contract.json --baseline-contract previous-scene-contract.json --format json --fail-on none"
    }
  ]
}
