{
  "schema_version": "1.0",
  "name": "godot-save-schema-guard",
  "entrypoint": "godot-save-guard",
  "module": "python -m godot_save_guard",
  "interfaces": {
    "cli": true,
    "machine_output": ["json"],
    "human_output": ["text", "markdown report"],
    "migration_chain_config": true,
    "migration_graph_check": true,
    "fixture_redaction": true,
    "report_metadata": true,
    "plain_language_rule_help": true,
    "visual_interface": "none"
  },
  "run_behavior": {
    "noninteractive": true,
    "safe_on_private_projects": true,
    "network_required": false,
    "writes_only_when_requested": true,
    "exit_codes": {
      "0": "no findings at selected fail threshold, or --fail-on none",
      "1": "findings met selected fail threshold or migration command failed",
      "2": "CLI or argument error"
    }
  },
  "recommended_commands": [
    {
      "purpose": "Script-friendly save validation",
      "command": "godot-save-guard validate <fixtures> --schema <schema.json> --format json --output save-report.json --fail-on none"
    },
    {
      "purpose": "Release compatibility report",
      "command": "godot-save-guard validate <fixtures> --schema <schema.json> --format markdown --output docs/SAVE_COMPATIBILITY.md"
    },
    {
      "purpose": "Review an ordered migration chain",
      "command": "godot-save-guard migrate-chain <fixtures> --chain migrations.toml --output-dir migrated --dry-run --format json --output migration-chain.json"
    },
    {
      "purpose": "Verify supported save versions can reach the current format",
      "command": "godot-save-guard migration-graph --chain migrations.toml --current <version> --supported <old-version> --format markdown"
    },
    {
      "purpose": "Write sanitized save fixture copies for sharing or CI artifacts",
      "command": "godot-save-guard redact <fixtures> --path player.name --path players.*.email --output-dir sanitized-fixtures --dry-run"
    }
  ]
}
